{
  "id": "secret_policy_repository",
  "name": "Repository Secret Policy",
  "status": "draft",
  "scope": "Repository, local development, CI, and future deployment environments.",
  "storageRule": "Secrets must never be committed to the repository.",
  "rotationRule": "Rotate secrets after exposure, role changes, or environment compromise.",
  "constraints": [
    "Use placeholders in examples.",
    "Document required secret names without values.",
    "Treat logs and fixtures as public unless explicitly classified."
  ]
}
